<?xml version="1.0" encoding="UTF-8" ?>
<xs:schema xmlns:xs="http://www.w3.org/2001/XMLSchema">
<xs:element name="student">
 <xs:complexType>
 
 <xs:sequence>
 <xs:element name="stu" maxOccurs="unbounded">
 <xs:complexType>
 <xs:sequence>
 <xs:element name="id" type="xs:integer"/>
 <xs:element name="name" type="xs:string"/>
 <xs:element name="department" type="xs:string"/>
 <xs:element name="email" type="xs:string"/>
 <xs:element name="mobileNumber" type="xs:integer"/>
 </xs:sequence>
 <xs:attribute name="stuid" type="xs:string" use="required"/>
 </xs:complexType>
 </xs:element>
 </xs:sequence>

 </xs:complexType> 
</xs:element> 
</xs:schema>